Name;Month;Star;Comment
Ural;1;1;Просто ужасно.
Ural;1;1;Компания,преступники!
Ural;1;5;Большое спасибо командиру корабля рейса U6 651 09.01.22 Москва-Барнаул
Ural;1;1;Ужасные авиалинии
Ural;1;1;Эпоха задержек подходит к концу. Я перестаю летать уральскими.
Ural;1;2;Компания жуликов
Ural;1;1;Никогда не летайте этой авиакомпанией
Ural;1;2;Туда и обратно по 6-8часов в ожидании рейса
Ural;1;4;Not so bad
Ural;1;3;Не самые лучшие )
Ural;1;1;Отвпатительльная компания!
Ural;1;1;Это хуже любого лоукостера.
Ural;1;1;Испорченный отпуск и праздники
Ural;1;1;Баг на сайте компании чуть не стоил рейса
Ural;1;5;Качество услуг Уральских авиалиний
Ural;1;1;Ужасно!
Ural;1;3;Давно не мотал себе нервов.
Ural;1;1;Ужасный сервис
Ural;1;5;.
Ural;1;1;Слышал такую жесть о победе, но уральские, видимо, ещё хуже
Ural;1;5;Спасибо большое
Ural;1;5;Я летела с дочерью из Калиниграда в Санкт Петербург рейсом 392,наш рейс был задержан по метеоусловиям аэропорта Храброво,поэтому пришлось долгое время сидеть,спасибо авиакомпании обеспечили горячим питанием,прохладительными напитками.На борту самолета бортпроводники создали комфортные условия,очень доброжелательные,а командиру экипажа особая благодарность при снегопадах в Санкт Петербурге сел очень мягко.Жаль,что когда командир говорит не представляется.Спасибо авиакомпания!
Ural;1;3;Полёт хороший, но за 5 часов не покормили, а доли только стакан Воды ! Это минус (
Ural;1;5;Приятно летать этими А/Л
Ural;1;1;Летели из Египта рейсом 7306 (22 января 2022), на борт пустили мужика пьяного настолько что еле стоял на ногах, ему продали на первый ряд билет прямо на стойке регистрации, весь полет он блевал, а стюардессы продавали ему через попутчицу алкоголь, все 5 часов полета как в аду, смрад, перегар, блевотина, кстати я так же купил билет на этот первый ряд для комфортного полета. На претензии стюардессам, сказали он же не буянит. Правила видимо касаются только тех кто буянит, остальным закон не писан включая экипаж. Безопасность и комфорт - гласит лозунг авиакомпании, вот уж не поспоришь!
Ural;1;5;Много прочитал отзывов. Больше плохих. Столкнулся лично, все понравилось. Небыло проволочек, задержек. Все по графику. Остался, приятно удивлён. Спасибо!
Ural;1;1;"Стоят на посадке и проверяют ручную кладь. Оштрафовали за превышение на стоимость билета! Аэропорт Домодедово
Более с этой компанией не буду летать. Летаю часто. 
Будьте внимательны. 
Не рекомендую данную компанию!
Пользуются ситуацией и угрозой не допуска на рейс!
Поведение компании по принципу ГИБДД!
"
Ural;1;1;Знайте одно, если вы летите этой авиакомпанией не из точки А  в точку Б, а будете пересаживатся на другой самолёт то зазор между рейсами должен быть минимум 8-12 часов. Вы вроде все продумали все купили, чтобы не долго сидеть между перелетами, но эта авиакомпания устроит вам экстрим с переносами рейсов без объективных причин, просто один рейс схлопывают и делают из двух один который позже.. 
Ural;1;1;На три часа задержали рейс и потеряли багаж. Супер-сервис!!!
Ural;1;1;"Задержка с 12:40 до 16:20 и еще раз до 17:30.
Пять часов ,  класс. Знакомый работает в сфере обслуживания ,  когда гости просят купить билет ,  сразу говорят только не Уральскими,  т.к. задержки вылета у них норма. Жаль узнала поздно."
Ural;1;1;Все рейсы этой авиакомпании задерживают! Все, без исключения… у них явно какие то проблемы, потому что самолет грязный, салфеток для головы нет, журналов нет - вода есть, это бы ничего, но повторю задержки всех рейсов, народ держат за скот, отсутствие какой либо информации реальном времени вылета и причинах.. 08.01.22 Екатеринбург-Санкт-Петербург задержка 10 часов.. по возможности сторонитесь этих ребят, в результате встанет дороже, а потраченные силы и нервы вообще не оценить)
Ural;1;1;В этой компании часов не наблюдают. Для чего расписание регулярных рейсов - не понятно. Летели в день рождения ребёнка, поэтому принципиально важно было вылететь рейсом в 16.00. Но следующий рейс на 17.30 вылетел раньше нашего. На горячей линии Уральских авиалиний сотрудники претензии не принимают и отправляют писать письма. От их извинений ни горячо, ни холодно. Просто отвратные авиалинии, в очередной раз разочаровали. Не советую летать ими ни в какой ситуации. Их билеты купила не из-за низкой цены, а именно из-за конкретного времени вылета. Фактически вылет был в 19 часов.
Ural;1;1;"08.01.2022 мы должны были улететь в Петербург из Хургады в 09:15 рейсом u67306. По приезду в аэропорт время перенесли на 10:30, всех зарегистрировали, мы дождались времени посадки, но не улетели даже в 11-00, потому что при начале посадки местные представители службы организации перевозок заявили пассажирам, что в самолёте не хватает 5 мест и пассажиры рейса должны инициативно принять решение, кто не летит, иначе самолёт не полетит вообще. Потом они предложили идею-шантаж автоматического отбора «добровольцев». Толпа взволновалась и начали активнее решать и думать. Из добровольцев вызвались 2 семейных пары , среди которых были и мы с предложенным условием, что мы нас отправят 09.01.22 таким же прямым рейсом, обеспечив жильём и едой. Пассажиры решили, что одного из детей кто-то возьмёт на руки, таким образом, недостающее 5-е  место как раз и закроется (пилот, видимо, согласился на нарушение правил). Люди нас поблагодарили и благополучно улетели и долетели. Мы рады, что мы помогли. Но нас позже местные работники аэропорта замучали  до такой степени, что слов нет, чтобы передать((( без еды, без воды, без сна, нас, шантажируя, отправили поздним вечером через Москву с пересадкой и ожиданием 10 часов, мы прилетели в Петербург около 13-00. Переговоры с туроператором и прочими структурами к действенным результатам не привели. Прекращайте продавать билетов больше, чем мест в самолете, больше денег все-равно не заработаете, это плохая схема!!!
"
Ural;1;1;Хуже авиакомпании просто не знаю. Прямо сейчас сижу в аэропорту в ожидании посадки на задержанный уже на 7,5 При чем о первоначальной задержки на 5 часов было заранее сообщено, а о последующей ещё как минимум на 2,5 сообщают уже по факту за 5 минут до озвученного ранее времени вылета.
Ural;1;1;Не очень понятно, что происходит в этой компании и как могут быть настолько не отлажены процессы. Жуткие задержки по всем направлениям. Мой рейс Иркутск-Москва 08.01.2022  был задержан на 1,5 часа без предварительного уведомления, а трансферный рейс Москва-Спб задержали на 2, и такая ситуация происходит не в первый раз.  
Ural;1;4;Авиакомпания как и все другие! Не больше и не меньше!
Ural;1;4;Неплохие авиалинии, задержка рейса обычное дело. Питаниеи бизнесе среднее. Летали с семьёй в Калининград, понравилось и нам и детям
Ural;1;3;Занизил оценку, за обычное для авиакомпаний дело - это не возвращать стоимость билетов в случае отказа пассажира лететь по состоянию здоровья, хотя была сделана справка в здравпункте аэропорта. Мурыжили меня как только могли: сначала сказали на сайте заявку на возврат оставить, потом типа надо в офис подойти в аэропорте, потом оказывается все таки через сайт, на сайте ответ пришел, что нужно письмо писать на центральный офис, я это письмо почтой россии отправил уже больше трех месяцев назад, а ответа так и нет. Верните десять тыщ.
Ural;2;1;Самая худшая авиакомпания
Ural;2;2;Летающие маршрутки с ужасным сервисом.
Ural;2;1;Самая отвратительная авиакомпания
Ural;2;1;Алчность- порождает бедность
Ural;2;1;Если вдруг Вы собираетесь лететь данной авиакомпанией, то я бы рекомендовал почитать отзывы и хорошо подумать!)
Ural;2;1;Бизнес класс -оказался эконом
Ural;2;1;Самая ужасная и ненадежная компания
Ural;2;5;Бортпроводники
Ural;2;1;"Нет слов, одни эмоции.

Должны были улетать в 20:00, в итоге взлетим только в 1:00!!!!
На 5 часов задержали рейс.

Рядом не сажают.
"
Ural;2;1;Летали чартером в Хургаду из Питера и обратно. В обоих случаях сам экипаж опаздывал на свой же рейс (на 1 час и на 35 минут) - позор  !!!  И самая главная разводка этой компании  -  раскидать всю семью (из 4х и 3х человек) по всему самолёту при наличии свободных мест  , чтобы пассажиры доплачивали за то, чтобы сидеть вместе по 1100₽ за место   !!!  Больше никогда и никому не посоветую  уральские авиалинии  -  ПОЗОР
Ural;2;3;"Летала уральскими авиалиниями лет 8 назад, все было хорошо, и кормили нормально и персонал вежливый и лейбл и самолетики красные.
Сейчас в феврале летала в Египет, персонал хамоватый, говорят одно, в итоге забывают, доплата за выбор места, если не платишь, то тебя и того с кем ты летишь сажают на разные ряды и потом в самолете все договариваются друг с другом о смене мест, зачем так делать - непонятно. При полете туда покормили какими-то бутербродами испорченными, потом мучала изжога, при полете обратно не кормили вообще, лейбл поменяли и сервис стал хуже некуда, лучше бы деньги потратили не на ребрендинг, а на сервис для клиента. Но спасибо, что туда и обратно вылетели без задержек, за это 3 звездочки. "
Ural;2;5;Я хотел поставить 5 звезд вашему сотруднику Рыжкина Екатерина Сергеевна которая работает в пулковском Санкт-Петербурге, я ей благодарен за её обслуживание и красивую улыбку))
Ural;2;5;"Отличная авиакомпания
Только работникам нужно повежливее с пассажирами и обслуживающим персоналом,а так все хорошо меня все устраивает пилоты молодцы конечно бывают срывы но редко"
Ural;2;4;Улететь смогла , покупала билет через интернет, рекомендую Аэрофлот.
Ural;2;1;"Отвратительные стюардессы!!!
Летел из Шарм Эль Шейха 10.02.2022г. в СПб.
ЖЕСТЬ!
В туалетах не убрано!!!((((((
Сделал им, сидящим в тлф за шторкой, они обиделись!( )))
Сказали мне, что они не убощицы!))"
Ural;2;1;Летим 11.02.2022, мало того, что первый рейс отменили и задержали на 4 часа, так ещё и новый самолет оказался короче, и место для багажа отсутвовало от слова совсем, не рекомендую эту авиакомпанию. Если что рейс Санкт-Петербург: Калининград....
Ural;2;1;"При регистрации на рейс онлайн - возникли проблемы с регистрацией супруги на сайте компании. 
Система не регистрировала ее,  т.к. в брони был трансфер на коляске по аэропорту.

При звонке службу 8 800... никакой помощи не получил.
Ни капли желания помочь, или даже сделать вид, что оно (желание помочь) есть...
Все на - ""отойдите""...  
Сотрудницу  даже не интересовал номер билета, который я ей намеривался сообщить.
Пассажира барышня окрестила ИНВАЛИДОМ (она доктор ,что ли ?). 
Несла ересь про ""определение мобильности на месте сотрудниками аэропорта"" (мобильность указывается в заявке на сопровождение заявителем).
Вишенкой на торте стал  ее высокомерный тон. 
Слова вроде все культурные, но полное ощущение ""хамства"".

От души желаю Uralairlines  вычислять подобных ""профессионалов"", и скорее прощаться с ними."
Ural;2;4;Летала пару раз туда-обратно по России и в Турцию. Без приключений. И на том спасибо.
Ural;3;1;"Ужасные (Уральские) авиалинии
Отвратительная Компания!!!!!!!
 Никогда не за какие деньги не летите !"
Ural;3;1;УЖАСНАЯ АВИАКОМПАНИЯ
Ural;3;1;Не советую
Ural;3;5;Отлично
Ural;3;1;Нам плевать на ваши проблемы
Ural;3;1;Бегите от этой компании
Ural;3;2;Плохая информированность пассажиров об изменении рейса
Ural;3;1;Ужасная компания!!!
Ural;3;1;Безответственность возведённая в степень!!!!
Ural;3;1;Ужасная компания ! Переносят, отменяю, теряю … не знаю, что хуже Уральские или ещё более ужастная компания
Ural;3;1;Не советую эту Авиакомпанию проста 0
Ural;3;2;Сотрудники компании на регистрации  в аэропорту Пулково крохоборы!!! Летели семьёй с ребёнком чартерный  рейс  и для того чтобы сесть  всем вместе  нам выписали чек пояснив , что за  рассадку отвечает компьютер , а он рассадил нас всех в разных местах. Подавитесь!!!! Какие сотрудники  такая и компания!!!
Ural;3;1;Билеты продаются А самолёт ✈отменяется а деньги также не сразу возвращается очень плохо всё не Каму не рекомендую 
Ural;3;3;Редко пишу отзывы но решил оставить, летаю уральскими авиалиниями СПБ-Узбекистан все нравится, очень вежливый персонал, быстрая регистрация, единственное как и у всех других авиакомпаний идет рост цен на билеты.
Ural;3;5;Очень много негативных отзывов - возмущение пассажиров понятно, сама бы возмущалась, конечно, когда не очень удачный полет, но хотелось бы добавить и положительных отзывов - ведь, когда все прошло хорошо, обычно не пишут. Мы не первый раз летаем Уральскими авиалиниями, и всегда нам везет - хорошие самолеты, приятный экипаж, без задержек, без эксцессов. Последний раз летали из Санкт-Петербурга в Сочи и обратно в сентябре 2021 г. Все прошло хорошо, вылет туда вовремя, обратно была задержка около часа по погодным условиям - в Сочи выпал град, задержали вылет. Ровный спокойный полет, приятные стюарды, вежливое обслуживание, комфортная сдача багажа (на небольшие перевесы по ручной клади и ее количеству не обратили внимания), хорошие взлет и посадка, адекватные цены на билеты. Никаких нареканий. Спасибо.
Ural;3;1;Постоянные задержки вылетов, неприбытие багажа, перенос рейсов без сохранения оплаченного тарифа.
Ural;3;1;"Ребята, если не хотите потратить нервишки и потерять кучу времени, убедительно настаиваю не пользоваться услугами данной авиакомпании. 13 марта рейс Санкт-Петербург- Ургенч, вылет в 7:55 посадка в 14:20, в итоге рейс перенести аж на 14 марта в 16:00!!!! Все бы ничего, если бы авиакомпания соизволила сообщить своим пассажирам о переносе, но куда уж там... Отслеживала свой рейс на онлайн табло Пулково и оттуда по счастливой случайности узнала, что рейс перенесли. Звонила  в Пулково - подтвердили перенос, сказали что это официальная информация. Далее звоню в авиакомпанию. Провисев в ожидании 30 мин. услышала от оператора такое "" да, на онлайн табло действительно вижу информацию о переносе, но в системе вылет все также без изменений в 7:55 так что все ок"" И что делать?! Ехать с багажом на такси за косарь или все таки нет? Звоню на другой номер той же авиакомпании, благо сразу взяли трубку, но не успела я обрадоваться, слышу в трубке хамоватую девушку. Спрашиваю у неё что с моим рейсом, она мне тут же отвечает "" его перенесли"" на мой вопрос ""почему не сообщаете о переносе"" она ответила "" мы этим сейчас и занимаемся"" (наглым, хамским тоном) Тут я уже поняла, что бессмысленно вообще что-либо говорить и положила трубку. Все бывает, но хамское отношение к своим же клиентам это дно. Очень разочарована в Уральских авиалиниях.  "
Ural;3;2;Летела  7 марта 2022 года из Алматы в Санкпетербург задержали рейс на 3 часа ,летели 5 часов не кормили перекусить дали бутерброд с чаем и стакан воды  и больше ничего хоть бы воды ещё предложили ,,равнодушные стюардесы.хотела купить тапочки чтобы раззуться чтоб ноги отдохнули так что  даже за деньги небыло не говоря без платных пользоваться компанией только  от без иссхожности
