Name;Month;Star;Comment
Россия;6;5;Часто летам с ак Россия, летали и за границу и по России, всегда хорошее отношение к своим пассажирам, бывало ,что задерживали рейс пару раз на 3 часа.
Россия;6;5;Хороший сервис.
Россия;7;1;Днище
Россия;7;1;не предупредили о переносе рейса
Россия;7;5;Хорошая авиакомпания.
Россия;7;5;. Одна из лучших авиакомпаний России, надежная, пунктуальная. Твёрдо и уверено держит своё звание «Россия»! Имеет широкую географию полетов. Надежная современная авиатехника. Опытные пилоты  и  бортпроводники, которые сделают  ваш полёт приятным, комфортным, а главное точным по расписанию.
Россия;7;5;Как всегда,все на высшем уровне!!!
Россия;7;5;"Претензий нет к компании. Летаю часто, в этом году 7 перелëтов, впереди ещë несколько. 
Увидимся! Так держать!"
Россия;7;5;Самая надёжная и пунктуальная авиакомпания. Лучшее инженено-техническое обслуживание.
Россия;7;1;Летели Калининград-Спб, 29.06, оплатили услугу выбор мест, чтоб точно лететь рядом и у окна. За часов 12 до вылета, заметили, что места поменяны, на неудобные нам, самолет заменили. Сразу позвонила, узнать в чем дело, как поменять обратно, вернут ли деньги. Девушка сказала конечно вернут, срок 7-10 дней, прошло 13 дней, так и не пришли деньги.. Это выглядит настолько некрасиво, что лететь этой компанией желания больше нет, ощущение как будто имели дело с мошенниками...слов нет,  1200р я понимаю, для кого-то не деньги, но с какого такого мы должны их просто так кому-то, а компания меняет места как ей нравится, даже если ты оплатил. Мы покупаем у вас услугу, а вы ее не оказываете, а потом врете и не возвращаете деньги. 
Россия;7;4;"Всегда нравилось летать данной авиакомпанией. Негативного опыта с ней не было.
Не дешёвые авиабилеты."
Россия;7;3;Уровень сервиса удовлетворительный, акции и распродажи билетов обычно проведятся редко, но в 2022 году было много лихих распродаж. Стоит отметить очень хорошие нормы ручной клади, непонятно зачем при покупке билета на внутренние рейсы данные пассажира нужно вводить латинскими буквами, если летим по общегражданским паспортам - это крайне неудобно для тех у кого нет загранпаспорта. Последний  раз летел из Пулково во Внуково, питание вообще пропало, разнесли только по стаканчику воды.
Россия;7;2;Авиакомпания должна заботиться о своих пассажирах  и вылетать вовремя.  
Россия;7;5;Летели в экономе и все понравилось! Приветливые стюарты, горячий и вкусный обед, пледы, чистый салон. Пятерка!
Россия;7;5;"Очень пунктуально, самолет в хорошем состоянии, удобный и просторный, все профессионально!
Экипаж внимательный и приятный! И даже горячее питание- на сегодняшний день-большая редкость!"
Россия;7;1;Купила билеты на рейс Россия, всегда нравились и нравятся! Но вопрос к представителям в аэропорту Внуково! К сожалению , ваших представителей там нет! И это очень сказывается на работе ваших сотрудников ! 4 июля в 22:30 я должна была вылететь из Внуково в Пулково, из- за задержки рейса с тремя детьми и двумя чемоданами прибежала к окну регистрации через три минуты после окончания регистрации! Две ваши сотрудницы окна 103-104 даже не скрывали своего равнодушия и нежелания мне помочь! Просто спокойно сказали идти в кассу! Обратите внимание на работу таких замечательных в больших кавычках людей! Они очень вредят  имиджу вашей компании! В итоге пришлось с тремя детьми покупать новые билеты, так как в кассе вместе с обменом билеты стоили дороже , чем я купила сама через сайт! Низкий поклон вашим сотрудницам, которые маму с тремя детьми, работника муниципальной службы с тремя детьми оставили в такой непростой ситуации! А в целом люблю вашу компанию 
Россия;7;5;Вежливый персонал, парк хороших бортов.
Россия;7;1;"Брал билет на ""аэрофлот"", подсунули ""россию""
Это как когда вызвал такси по ""комфорту"" А приезжает мигрант на старых ""Жигулях""
Покупал билеты специально на рейс аэрофлота, Архангельск-Спб, вместо него полетела авиакомпания ""Россия"" Самолет грязный, полиграфия в креслах как из задницы, места для пассажиров с детьми после 5 минут онлайн-регистрации только над крылом. На борту только вода, никаких плюшек, вроде привычных детям рюкзачков с раскрасками нет.
Сказали, что такая замена авиакомаании норма-ведь они партнеры. 
Год прошел, коронавирус прошел, ничего не поменялось. На борту только вода, есть выбор: с газом или по - европейски"
Россия;7;5;Хороший сервис, даже по билетам эконом класса всё вполне комфортно. Даже чаем угощают и выпечкой.
Россия;7;1;Совсем не ценят часто летающих пассажиров. Летел с девушкой, одно Бронирование, для меня место space+ Бесплатно, для неё с доплатой, что за бред? Ремень безопасности ну очень короткий! 
Россия;8;1;Спейс места
Россия;8;5;Один из самых гибких лоукостеров! Удобные небольшие самолеты, вежливый персонал и честная цена на билеты. А еще конечно адекватный размер ручной клади, это вам не победа!)
Россия;8;5;Все ок!Летали в Красноярск!
Россия;8;5;Я в полном восторге! Никогда ещё, ни одна авиакомпания, не заботилась о моем комфорте и комфорте моей семьи в полете так, как заботится Россия! Мальчики, бортпроводники, замечательные ребята, с ними еще милая девушка, очень внимательные,  вежливые! Выполнялся рейс Казань-Санкт-Петербург, 27.08. Мне было спокойно и комфортно как никогда! Спасибо Пилоту и ребятам, бортпроводникам!!!
Россия;8;1;Стояли в самолете 25 минут ждали автобуса ! В Пулково 
Россия;8;4;Одна из крупнейших авиакомпаний России. Борется за свой имидж. В случае возникновения проблем, персонал старается решить возникшие вопросы оперативно.
Россия;8;5;Я летела из Орска в СПб рейсом SU6456 22 августа произошла внештатная ситуация и мы кружили над городом и Уральскими горами около 3 часов , было мягко сказать некомфортно , пришлось возвращаться вместо СПб в Орск . Хочу отметить профессионализм и слаженность лётной команды . Было страшно , но они сработали мастерски , браво ! Дай бог им доброго здоровья и всегда мягкой посадки и чистого неба !
Россия;8;5;Все по делу
Россия;8;1;"Задержали рейс, не успели по их вине к тёще на блины
Возмутительно!"
Россия;8;5;Первый раз пользовался этой авиакомпанией. Понравилось! Очень хорошо работает весь персонал! Кормят, что очень комфортно. Всем рекомендую!
Россия;8;5;Хороший аэропорт.
Россия;8;5;Долетели. Приятные бортпроводники. Всё хорошо. Слава Богу!!!
Россия;8;2;"Раньше эта авиакомпания была самой лучшей.
Сейчас фиг поймешь что.
Пустили на рейс Москва-Сочи. Через 30 минут говорят что самолет взлетит не может. Сказав, оставаться на местах, не выходить. Просидели так 3 ЧАСА. Решили взлететь. Кормили хорошо. Посадка была жесткой, хотя раньше была очень мягкой. 
После полета, мы зашли в аэропорт Сочи, Адлер. Багажа еле еле дождались. Появилось спустя 10 минут чемоданов 5, и закончилось все. Выдача багажа окончена, спустя минут 20 после окончания появился багаж. "
Россия;8;5;Здорово. Хорошая авиакомпания, и накормили и спать уложили. Перелёт был ночной.
Россия;8;5;Всё отлично, только по ВПД билет невозможно купить в Чите
Россия;8;5;Слетали в августе 2021 с авиакомпанией Россия в Турцию. Начиталась ужасных отзывов, но поменять уже некогда было. Я не понимаю, кто пишет такие плохие отзывы. Если не считать задержку рейса на 1 час из Казани в Анталию и наоборот, то всё было отлично! Неужели, это прям минус такой? Прям всё идеальньо было. Персонал очень вежливый, добропорядочный, полёт был лёгким, салон самолёта чистый. Спасибо огромное всему экипажу  за вашу работу!
Россия;8;1;Ужасная авиакомпания! Был оставлен телефон на борту самолёта. В авиакомпанию был направлен официальный запрос, ответа так и не дождались. Звонили непосредственно представителям авиакомпании в Шереметьево, а также в камеру хранения, но телефон так и не нашли. Вывод один- сотрудники присвоили себе чужую вещь!
Россия;9;1;ПОЗОР! САМАЯ ХУДШАЯ КОМПАНИЯ!
Россия;9;1;"Добрый день. Авиакомпания ""Россия"". Постоянные задержки в Екб. Рейс 6401. Типа из-за погодных условий. Но и ""Победа"" и ""Смартавиа""вылетели без опозданий. Не первый раз такое. Предыдущий мой вылет неделю назад -все тоже самое. На 5 часов минимум задержки ."
Россия;9;3;Рейс SU6769 Сочи-Каир. По сравнению с Аэрофлот - намного ниже качество! Мужской Голос автоинформатора просто жесть!!! Как будто в последний путь отправляет. Смените срочно!!!
Россия;9;5;"Мне больше нравятся другие перевозчики...все.
В России барышни уж очень строгие, требовательные, человечности нинимум.
Я избегаю эту авиакомпанию, хоть и по сути плохого ничего не было."
Россия;9;5;Летели рейсом su 6412 Уфа-Санкт - Петербург 10 сентября, на самолёте в честь города Иваново. Очень положительные эмоции, мягкий взлёт, посадка, очень приятный персонал. В полёте подавали напитки и выпечку к чаю, несмотря на короткий перелёт. Спасибо 
Россия;9;5;"Многие в моём возрасте летали на самолёте уже много раз, но у меня это было впервые😅
Мне очень понравилось😍Совсем не страшно😌
При взлёте не смогла сдержать слёзы радости🤭Летели компанией ""Россия"" на Boeing 737-800✈️, пока покупали билеты читали отзывы и странно, но было много негативных в сторону персонала 🤔А нам они очень понравились❣️Весёлые, добрые и общительные)
2 часа 30 минут⌛ пролетели незаметно, разливали (чай/кофе/7up/вода/пепси) на выбор😁
Читала прикольный журнал о путешествиях, который лежал в самолёте📕 и слушала музыку🎶Нам повезло с соседкой, которая сидела возле окна😄, поэтому я без стеснений залепала в окно🤩"
Россия;9;5;Сервис на уровне. Пилоты профессионалы своего дела!
Россия;9;5;Не лучшая конечно но и не худшая точно крепкий соредничок со знаком плюс с добротным обслуживанием воздушных судов и опытным персоналом
Россия;9;5;Как всегда,все на уровне. Так держать
Россия;9;5;Очень понравилось лететь этой компанией. Свежий самолёт, очень удобно.
Россия;9;5;одна из лучших компаний Мира! :)
Россия;9;5;Добрый день!Летели  16.08.2022 года рейсом 6057 по маршруту Санкт -Петербург  -   Сочи. Во время полета резко ухудшилось общее состояние, рвота и головная боль. Бригада бортпроводников в составе : Захаровой Ирины, Масленниковой Ирины, Бурлаку Таисия, Логиновой Татьяны, Смирновой Виктории быстро отреагировали и оказали необходимую помощь.Большое спасибо данной бригаде за оказанную помошь , внимание и заботу.
Россия;10;1;Всем доброго вечера. Сейчас за бортом SJ100 30.10.2022, 22.20 МСК. В очередной раз, авиакомпания Россия и аэропорт Пулково дарят «приятно томительные» минуты (порядка 25 минут на момент написания этих строк) ожидания автобуса, для поездки от самолета до здания аэропорта... Ситуация не нова. С завидной постоянностью повторяется. Чудесная организация процесса перевозки удивительным образом сочетается с ожиданиями проведения воскресного вечера на борту SuperJet100 где-то на задворках территории аэропорта. От всей души хочется пожелать пассажирам терпения и хорошего вечера. А авиакомпании Россия и руководству аэропорта Пулково начать наконец-то работать в интересах пассажиров.. Еще раз всем добра.
Россия;10;5;"Очень хороошая авиакомпания. У нас был перелет с трансфером до Калининграда, нас встретили в зале и показали куда идти. Посадили с мужем рядом без всякой доплаты в отличие от авиакомпании ""Победа"". Также не замеряли размер ручной клади, опять-таки в отличие от ""Победы"". Летели на СУ. Полет прошел гладко, без задержек. И что большая редкость сейчас - кормили."
Россия;10;1;Питания на борту на рейсах до 3 часов по факту нет. Вам дают кусок пальмового масла, который даже собаке не кинешь. На стойках в аэропорту неразбериха. По факту оплаченный выбор мест не предоставляется, потому что у них технические проблемы. Покупаешь билет на аэрофлот, летишь недопобедой
Россия;10;5;Летал много раз, все на самом высоком уровне! Самолёты с качественной отделкой и шумоизоляцией. Полет для меня стресс, с этой компанией, я спокоен
Россия;10;5;На сегодня в России нет конкурентов для АК» Россия» … Всё - флот , география полетов , обеспечение - все на высоте !
Россия;10;1;"Летели сегодня авиакомпанией Россия Сочи - Санкт-Петербург фв6566, что же много хочется сказать о рейсе...
Как компания вы позиционирует себя на высшем уровне как и Аэрофлот, но вам до него расти и расти .. во первых не работала мультимедиа за что извинились, во вторых закончился срок прямо во время его разноса (раздачи) на половине экономсалона ( видимо по мнению руководства половина и вовсе не люди и не пассажиры компании. Лохи стерпят . Так наверное вы думаете. Еда (рыба с рисом вообще безо всякого вкуса)
Далее принесли чай!) Лимон тоже уноз закончился на половине салона... А сам чай, это шедевр жадности, бледный и безвкусный. 
Такое впечатление, что одним  пакетиком дешёвого чая  персонал заваривал чай половине салона.  Нескончаемая очередь в туалет в хвостовую часть салона. Экономав туалет в носовой части просто не пустили. Очередь стояла половину полета!!! Бортпроводники на вызов (,не единичный, пришли только с третьего раза, воды просил пассажир... и после ругались сзади за шторкой кому идти надо было, что слышно было многим . . Только пилотам после перелета хочется сказать спасибо. Остальным членам экипажа не хочется ничего говорить хорошего. Рейс FV6566 вылет из Сочи в 18,55. 
Для себя сделал вывод, цена перелета данной компанией не соответвует уровню которым она себя позиционирует. 
Похоже жадность превысила качество оказываемых услуг  в несколько раз . "
Россия;10;5;Летают и хорошо.
Россия;10;1;Для бухгалтерии понадобилась справка подтверждение факта перелета на рейсе SU 6134 Грозный - Санкт-Петербург. Заказал справку через официальный сайт. Оплатил 500 руб, сказали ждать 10 рабочих дней. Прошло больше двух недель, ни справки, нет ниодного номера по которому мне бы смогли корректно объяснить что по моей справке. Все операторы ничем не могут помочь. 
Россия;10;1;Задержали рейс 6346 на два с лишним часа. Мурманск - СПб. Ужас.. 
Россия;11;5;Хорошая авиакомпания для дальних полетов
Россия;11;1;Просто потеряли багаж
Россия;11;4;Нормальная авиакомпания, по ручной клади как в Аэрофлоте и получше чем у смартов. Осваивает отечественную авиатехнику в виде суперджетов....
Россия;11;5;"На высшем уровне. Самолёт превосходный, приятный полет, мягкая посадка, персонал вежливый, все отлично

"
Россия;11;3;"Добрый день! Хочу поделиться впечатлениями, являюсь частым пассажиром этой А/К и был умерено рад пользоваться их услугами перевозки, до последнего раза! К пунктуальности, вежливости и обслуживанию офлайн нет вопросов, достойная 5 и 5
Но при бронировании исчезла возможность выбирать бортовое питание и не начислили мили за перелет, вызвано это переходом на отечественную систему бронирования и покупки билетов, надеюсь скоро все исправят"
